Characteristics, Description
Volume," Large Volumes of data (Terra, Petabytes) spanning large areas"
Velocity,Produced in near-real time
Vareity,"Diverse in data sources, quality, structuredness, referenced spatially and temporally"
Exhaustive,"usually n=all, or at least claims to be"
Resolution,"Fine grained, temporally, spatially and along other dimensions"
Relational,"Usually merged with other datasets, likely through geographic identifiers"
Flexible,"Accommodate new data streams, sensors etc."
Scalable,Expanded rapidly